page,title,header1,header2,header3,header4,content,ref,file
27,Đồng Thuận Quan Điểm Của Một Số Chuyên Gia Của Phân Hội Tăng Huyết Áp VSH/ VNHA 2024 Về Chiến Lược Thực Hành Lâm Sàng Quản Lý Tăng Huyết Áp tại Việt Nam,"Phần II: Đồng Thuận Về Chiến Lược Thực Hành Lâm Sàng Quản Lý
Tăng Huyết Áp Tại Việt Nam","THÔNG ĐIỆP CHIẾN LƯỢC: THẦY THUỐC CẦN CẬP NHẬT NHỮNG TIẾN BỘ
ĐỂ CÓ MỘT CHIẾN LƯỢC THỰC HÀNH LÂM SÀNG THA TOÀN DIỆN HIỆU QUẢ",,,"- Phân loại huyết áp gồm: huyết áp không tăng, tiền tăng huyết áp và tăng huyết áp
- Áp dụng “Lộ trình chiến lược 5Đ quản lý toàn diện THA của VSH/VNHA 2024”.
- Bệnh nhân là trung tâm, được trao quyền tự đo, theo dõi và giáo dục nhận thức hành động tuân thủ để
đạt mục tiêu điều trị
- Đo chẩn đoán chính xác THA. Đánh giá bệnh nhân toàn diện. Cá thể hóa phác đồ điều trị. Theo dõi đáp
ứng điều trị. Duy trì sự tuân thủ
- Mục tiêu theo cá thể hóa: Mục tiêu theo cá thể hóa: HATT/HATTr <130/80mmHg, có thể hạ thấp hơn nữa
đến <120/70mmHg nếu dung nạp tốt hoặc kém dung nạp theo nguyên tắc ALARA nhưng ít nhất HATT
<140mmHg, đặc biệt ở người ≥ 85 tuổi, có tình trạng suy yếu, hạ huyết áp tư thế triệu chứng, tuổi thọ hạn chế.
- Tích cực thay đổi lối sống: Hạn chế natri và tăng kali, hạn chế đồ ngọt tự do, giảm rượu bia, tiết thực
DASH, tập luyện gắng sức bổ sung với sức đề kháng trong an toàn, ngừng hút thuốc...
- Điều trị thuốc ngay cho bệnh nhân chẩn đoán THA hoặc sớm ở Tiền THA có nguy cơ cao
- Điều trị dựa trên A, C, D và spironolactone khi khó kiểm soát, sử dụng B chỉ khi có chỉ định cụ thể.
- Thêm ARNI, SGLT2i, GLP1-RA, nsMRA trong một số bệnh đồng mắc.
- Khởi trị phối hợp đôi liều thấp, nếu không đạt chuyển sang phối hợp ba liều thấp cho đa số THA
- Đánh giá chẩn đoán và điều trị đúng mức THA kháng trị cũng như THA có các bệnh đồng mắc
- Triệt đốt thần kinh thận giao cảm qua động mạch thận có thể được xem xét cho bệnh nhân THA kháng trị
hoặc không kiểm soát với đội ngũ cơ sở đã được đào tạo đầy đủ với lượng thủ thuật trung bình cao và có
sự đồng ý của bệnh nhân.",,